{
  "governing_id": "SR-GOV-000002",
  "title": "Reditus & Structura Reditus: Field Constitution & Core-Object Formalization for Admissible Return Through Collapse",
  "source_id": "SRC-000035",
  "version": "June 2026 (title-page date; no version label stated)",
  "status": "active",
  "governing_role": [
    "constitutional"
  ],
  "authority_scope": {
    "tier_1": [
      "Field constitution: Reditus defined as the core object (admissible return of structure through collapse under declared conditions) and Structura Reditus as the field that studies it; Axiom-0 as governing axiom; admissible return distinguished from repetition, persistence, resemblance, repair, recovery by assertion, and rhetorical continuity.",
      "Order of the mature hierarchy: object before field, field before theory, theory before protocol, protocol before domain application."
    ],
    "tier_0": []
  },
  "source_role": "Constitutional object-field relation (handoff manifest).",
  "immutable_record": true,
  "active_from": "2026-09-13T04:28:50Z",
  "supersedes": null,
  "superseded_by": null,
  "doi": null,
  "canonical_link": null,
  "scope": "States what the object is, what the field is, how the mature hierarchy is ordered, and what burden must be satisfied before a structure may receive return credit.",
  "non_goal": "Does not replace the technical collapse-kernel reference, the operational whitepaper, the worked passes, the closure papers, or the teaching route; does not re-prove every kernel identity, reproduce every domain closure, or restate the complete publication architecture.",
  "missingness": [
    {
      "item": "DOI / archive deposit",
      "class": "NON_BLOCKING",
      "notes": "Not established by the supplied source; identity anchored to the handoff bundle hash on SRC-000035."
    }
  ],
  "notes": "Preserves the Tier-1/Tier-0/Tier-2 distinction as stated by the source; the record's own admitted burden is constitutional (Tier-1-bearing), not protocol."
}
