{
  "governing_id": "SR-GOV-000010",
  "title": "Generative Collapse Dynamics (UMCP/GCD): Enabling Cross-Domain Comparability via Contract-Frozen Kernel Invariants and Typed Return",
  "source_id": "SRC-000015",
  "version": "Whitepaper — release line v2.1.5 (March 2026)",
  "status": "active",
  "governing_role": [
    "kernel-reference",
    "specification"
  ],
  "authority_scope": {
    "tier_1": [
      "Tier-1 kernel ledger {ω, F, S, C, τ_R, κ, IC} computed only by the kernel on the bounded trace under the active frozen contract; symbols reserved (no redefinition by prose, domain semantics, or overlays); the identities F + ω = 1, IC ≤ F, IC = exp(κ)."
    ],
    "tier_0": [
      "Tier-0 measurable interface: observables x(t), adapter N_K, bounds/OOR and missingness policy, return settings (norm, η, D_θ); frozen parameter set (ε, p, α, tol_seam); conjunctive four-gate regime classification; seam budget identity Δκ = R·τ_R − (D_ω + D_C); segments with τ_R = ∞_rec typed as censored for return credit."
    ]
  },
  "source_role": "Fixed operational whitepaper artifact; preferred DOI 10.5281/zenodo.18819238 (handoff manifest; title page).",
  "immutable_record": true,
  "active_from": "2026-09-13T04:28:50Z",
  "supersedes": null,
  "superseded_by": null,
  "doi": "10.5281/zenodo.18819238",
  "canonical_link": "https://doi.org/10.5281/zenodo.18819238",
  "scope": "What the framework computes: kernel ledger, typed return, recurring diagnostics (Δ = F − IC, ρ = IC/F), frozen parameters and structural constants, regime classification, seam budget, and the v2.1.5 verification summary (16 domain closures, 406 scale-ladder objects).",
  "non_goal": "Tier-2 objects (scores, labels, narratives, auxiliary diagnostics) may be introduced only as diagnostics and must not be used as regime or weld gates unless promoted through an explicit seam, a new frozen run, and a recorded weld decision; the whitepaper's predictions are stated as unverified as of v2.1.5.",
  "missingness": [
    {
      "item": "DOI lineage",
      "class": "UNRESOLVED_SEAM",
      "notes": "Alternate DOI 10.5281/zenodo.18819239 in external metadata; see SEAM-0009 and SRC-000015."
    }
  ],
  "notes": "Title page also cites canon context 10.5281/zenodo.17756705 (PRE) and 10.5281/zenodo.18072852 (POST), Weld-ID W-2025-12-31-PHYS-COHERENCE, and software DOI 10.5281/zenodo.18616616; those are the source's citations, not identifiers of this record."
}
