{
  "governing_id": "SR-GOV-000003",
  "title": "Generative Collapse Dynamics: Canon Placement and the Two-Axis Architecture",
  "source_id": "SRC-000036",
  "version": "June 2026 (title-page date; no version label stated)",
  "status": "active",
  "governing_role": [
    "constitutional",
    "canon-facing"
  ],
  "authority_scope": {
    "tier_1": [
      "Places GCD as the foundational (highest-level) theory inside Structura Reditus and fixes that the tier architecture (authority) and the functional systems architecture (operation) are orthogonal structures generated by the same theory."
    ],
    "tier_0": []
  },
  "source_role": "Places GCD as foundational theory; separates authority and function. Placement report, not a new authority tier (handoff manifest).",
  "immutable_record": true,
  "active_from": "2026-09-13T04:28:50Z",
  "supersedes": null,
  "superseded_by": null,
  "doi": null,
  "canonical_link": null,
  "scope": "Canon placement of GCD after the distinction between object, field, theory, protocol, discovery engine, language system, and domain closure has become explicit.",
  "non_goal": "Does not introduce a new theory, revise Axiom-0, redefine the Tier-1 kernel, alter the UMCP protocol, replace RCFT, reassign ULRC, add a new tier, promote Tier-2 diagnostics into Tier-1 or Tier-0, or create a new framework outside the existing corpus. Its purpose is placement and formal clarification.",
  "missingness": [
    {
      "item": "DOI / archive deposit",
      "class": "NON_BLOCKING",
      "notes": "Not established by the supplied source."
    }
  ],
  "notes": ""
}
