{
  "governing_id": "SR-GOV-000017",
  "title": "GCD / UMCP — Entering the Corpus: Ingress, Publication Architecture, and Guided Routes",
  "source_id": "SRC-000044",
  "version": "April 20, 2026 (no version label stated)",
  "status": "unresolved",
  "governing_role": [
    "ingress",
    "publication-protocol"
  ],
  "authority_scope": {
    "tier_1": [],
    "tier_0": []
  },
  "source_role": "Publication/route architecture; navigation is not authority promotion (handoff manifest).",
  "immutable_record": true,
  "active_from": "2026-09-13T04:28:50Z",
  "supersedes": null,
  "superseded_by": null,
  "doi": null,
  "canonical_link": null,
  "scope": "Publication architecture of the corpus, one primary burden per paper family, decision rules for route choice, and the casepack ladder following The First Pass.",
  "non_goal": "Companion rather than constitutional: does not replace the Orientation Series, restate the full constitutional derivation, replace continuity or weld papers, or compete with closure papers on domain substance.",
  "missingness": [
    {
      "item": "Governing status after the June 2026 Ingress Paper",
      "class": "UNRESOLVED_SEAM",
      "notes": "The later Ingress Paper (SR-GOV-000016) replaces the three-part orientation burden; neither source states whether this April 2026 route companion remains the active route reference. Not reconciled."
    },
    {
      "item": "DOI / archive deposit",
      "class": "NON_BLOCKING",
      "notes": "Not established by the supplied source."
    }
  ],
  "notes": ""
}
