{
  "governing_id": "SR-GOV-000004",
  "title": "The Functional Systems of Generative Collapse Dynamics",
  "source_id": "SRC-000037",
  "version": "June 2026 (title-page date; no version label stated)",
  "status": "active",
  "governing_role": [
    "functional-source",
    "constitutional"
  ],
  "authority_scope": {
    "tier_1": [
      "Functional placement generated by GCD: UMCP measures, RCFT explores, ULRC preserves language; functional systems are the operating architecture and are not authority tiers."
    ],
    "tier_0": []
  },
  "source_role": "Consolidated functional architecture of UMCP, RCFT, ULRC; functional systems are not authority tiers (handoff manifest).",
  "immutable_record": true,
  "active_from": "2026-09-13T04:28:50Z",
  "supersedes": null,
  "superseded_by": null,
  "doi": null,
  "canonical_link": null,
  "scope": "Formalizes the relation among UMCP, RCFT, and ULRC after the mature hierarchy has been fixed: freeze before judgment, explore before canon, translate without drift.",
  "non_goal": "Does not replace the field constitution, the formal definition of Reditus, the theoretical canon placement of GCD, the technical kernel specification, the worked passes, the domain closure papers, or the teaching route; does not convert UMCP, RCFT, or ULRC into tiers.",
  "missingness": [
    {
      "item": "DOI / archive deposit",
      "class": "NON_BLOCKING",
      "notes": "Not established by the supplied source."
    }
  ],
  "notes": "The operating grammar of each functional system is admitted from its own Operating System paper (SR-GOV-000006..008), not from this consolidation."
}
